"Nama"	"Alamat"	"Telpon"	"Fax"	"Kota"	"Situs"	"Cabang"	"keg1"	"keg2"	"keg3"	"keg4"	"keg5"	"keg6"	"keg7"	"keg8"	"keg9"	"keg10"	"keg11"	"keg12"
"Rumah Zakat"	"Jl. Turangga No.25 C "	"022-7332407 "	"022-7332407 "	"Bandung"	"http://rumahzakat.org"	0	"beasiswa"	"laboratorium"	"mobil juara"	"perbaikan gizi"	"kemah"	"Rumah Bersalin Gratiis"	"Layanan Bersalin Grat"	"penyuluhan"	"ambulance"	"posyandu"	"modal kerja"	"pelatihan"
"Rumah Zakat1"	"Ruko Lamlagang, Jl. Sultan Malikul Saleh, Kel. Lamlagang, Kec. Banda Raya"	"0651-7429692 "	0	"Aceh."	0	"Rumah Zakat"	0	0	0	0	0	0	0	0	0	0	0	
"Rumah Zakat2"	"Jl. Veteran No.9 Kel. Mujamuju, Kec. Umbulharjo"	"0274-377671 "	"0274-377671 "	"Yogyakarta"	0	"Rumah Zakat"	0	0	0	0	0	0	0	0	0	0	0	
"Rumah Zakat3"	"Jl. Radio Dalam Raya No. 47"	"021- 7396 908 "	0	"Jakarta Pusat"	0	"Rumah Zakat"	0	0	0	0	0	0	0	0	0	0	0	
"Rumah Zakat4"	"Jl. Srengseng Raya Barat No.98A Kebon Jeruk"	"021-5858023 "	0	"Jakarta Barat"	0	"Rumah Zakat"	0	0	0	0	0	0	0	0	0	0	0	
"Rumah Zakat5"	"Jl. Terusan Boulevard Timur Raya No. 1A RT 05/02"	"021-46828867 "	0	"Jakarta Barat"	0	"Rumah Zakat"	0	0	0	0	0	0	0	0	0	0	0	
"Rumah Zakat6"	"Jl. Gunung Sahari I No.35"	"021-42800754 "	0	"Jakarta Pusat"	0	"Rumah Zakat"	0	0	0	0	0	0	0	0	0	0	0	
"Rumah Zakat7"	"Basement Floor R.05, Jl. M.H Thamrin Kav. 3"	"021-2300733 "	"021-2300733/021-95578600 "	"Jakarta Pusat"	0	"Rumah Zakat"	0	0	0	0	0	0	0	0	0	0	0	
"Rumah Zakat8"	"Rasuna Office Park, No.LR.02, Apartemen Taman Rasuna, Tower 8, Jl. HR. Rasuna Said Kuningan"	"021-94740907 "	0	"Jakarta Selatan"	0	"Rumah Zakat"	0	0	0	0	0	0	0	0	0	0	0	
"Rumah Zakat9"	"Jl. Wijaya 1 Kel. Petogogan, Kec. Kebayoran Baru"	"021-7234039 "	"021-7234039 "	"Jakarta Selatan"	0	"Rumah Zakat"	0	0	0	0	0	0	0	0	0	0	0	
"Rumah Zakat10"	"Jl. RM. Harsono No.15A Kel. Ragunan, Kec. Pasar Minggu"	"021-7884287 "	"021-78842287 "	"Jakarta Selatan"	0	"Rumah Zakat"	0	0	0	0	0	0	0	0	0	0	0	
"Rumah Zakat11"	"Rukan Mitra Matraman, Jl. Matraman Raya No.148 Blok A1 No.5"	"021-85918021 "	"021-85918020 "	"Jakarta Timur"	0	"Rumah Zakat"	0	0	0	0	0	0	0	0	0	0	0	
"Rumah Zakat12"	"Jl. Turangga No.33"	"022-7332451 "	"022-7317400 "	"Bandung"	0	"Rumah Zakat"	0	0	0	0	0	0	0	0	0	0	0	
"Rumah Zakat13"	"Jl. Ir. Juanda No.91"	"022-70773297 "	0	"Bandung"	0	"Rumah Zakat"	0	0	0	0	0	0	0	0	0	0	0	
"Rumah Zakat14"	"Jl. Terusan Jakarta No.77 Kec. Antapani"	"022-70739192 "	0	"Bandung"	0	"Rumah Zakat"	0	0	0	0	0	0	0	0	0	0	0	
"Rumah Zakat15"	"Jl. Prof. Dr. Ir. Sutami No.89 Bandung"	"022-70474711 "	0	"Bandung"	0	"Rumah Zakat"	0	0	0	0	0	0	0	0	0	0	0	
"Rumah Zakat16"	"Komplek Lotus Garden Blok A No.8 Kel. Teluk Tering, Kec. Batam Kota"	"0778-468024 "	"0778-468024 "	"Batam"	0	"Rumah Zakat"	0	0	0	0	0	0	0	0	0	0	0	
"Rumah Zakat17"	"Jl. Veteran No.110 B Bekasi Selatan"	"021-88851159 "	"021-88851159 "	"Bekasi"	0	"Rumah Zakat"	0	0	0	0	0	0	0	0	0	0	0	
"Rumah Zakat18"	"Jl. Pandawa Raya Blok IB, Komplek Indraprasta, Kel. Bantar Jati, Kec. Bogor Utara"	"0251-8378945 "	0	"Bogor"	0	"Rumah Zakat"	0	0	0	0	0	0	0	0	0	0	0	
"Rumah Zakat19"	"Ruko Pavilion Shop Jl. Industri Utara No. 9 Jababeka 2"	"021-89840499 "	"021-89840661 "	"Cikarang"	0	"Rumah Zakat"	0	0	0	0	0	0	0	0	0	0	0	
"Rumah Zakat20"	"Jl. Letjend R. Suprapto No.25G"	"0254-385443 "	0	"Cilegon"	0	"Rumah Zakat"	0	0	0	0	0	0	0	0	0	0	0	
"Rumah Zakat21"	"Jl. Gedung Empat No.E.3 Gatot Subroto"	"022-70723062 "	0	"Cimahi"	0	"Rumah Zakat"	0	0	0	0	0	0	0	0	0	0	0	
"Rumah Zakat22"	"Taman Rempoa Indah, Jl. Delima Jaya Ciputat Timur"	"021-26329700 "	0	"Ciputat"	0	"Rumah Zakat"	0	0	0	0	0	0	0	0	0	0	0	
"Rumah Zakat23"	"Jl. Tuparev Komp. Ruko Cirebon Bisnis Centre (CBC) Blok D8"	"0231-237399 "	0	"Cirebon"	0	"Rumah Zakat"	0	0	0	0	0	0	0	0	0	0	0	
"Rumah Zakat24"	"Jl, Tole Iskandar, Ruko Griya Depok Asri Blok B1 No.2C"	"021-77824992 "	"021-23711522 "	"Depok"	0	"Rumah Zakat"	0	0	0	0	0	0	0	0	0	0	0	
"Rumah Zakat25"	"Jl. Beringin Raya No.144C Perumnas"	"021-5588811 "	0	"Tangerang"	0	"Rumah Zakat"	0	0	0	0	0	0	0	0	0	0	0	
"Rumah Zakat26"	"Jl. Dr. Sutomo No.53"	"024-70780960 "	0	"Semarang"	0	"Rumah Zakat"	0	0	0	0	0	0	0	0	0	0	0	
"Rumah Zakat27"	"Jl. Kartini No.10 Kel. Pocanan, Kec. Kota"	"0354-7604700 "	0	"Kediri"	0	"Rumah Zakat"	0	0	0	0	0	0	0	0	0	0	0	
"Rumah Zakat28"	"Ruko Istana, Jl. W.R Supratman C3 Kav.19"	"0341-351932 "	0	"Malang"	0	"Rumah Zakat"	0	0	0	0	0	0	0	0	0	0	0	
"Rumah Zakat29"	"Jl. Raya Nginden No.29"	"031-5914145 "	"031-5914145 "	"Surabaya"	0	"Rumah Zakat"	0	0	0	0	0	0	0	0	0	0	0	
"Rumah Zakat30"	"Jl. Dukuh Kampung Barat No.329"	"031-78458991 "	0	"Surabaya"	0	"Rumah Zakat"	0	0	0	0	0	0	0	0	0	0	0	
"Rumah Zakat31"	"Jl. Raya Menganti No. 17 B Wiyung"	"031-78458992 "	0	"Surabaya"	0	"Rumah Zakat"	0	0	0	0	0	0	0	0	0	0	0	
"Rumah Zakat32"	"Jl. Kali Larangan No.39 Kel. Jayengan, Kec. Serengan"	"0271-7072671 "	0	"Surabaya"	0	"Rumah Zakat"	0	0	0	0	0	0	0	0	0	0	0	
"Rumah Zakat33"	"Jl. Irian No.35 Kel. Akcaya, Kec. Pontianak Selatan"	"0561-736809 "	0	"Pontianak"	0	"Rumah Zakat"	0	0	0	0	0	0	0	0	0	0	0	
"Rumah Zakat34"	"Jl. MT. Haryono, Ruko Balikpapan Baru Blok D4 No.6 Kel. Damai, Kec. Balikpapan Selatan"	"0542-873411 "	"0542-873411 "	"Balikpapan"	0	"Rumah Zakat"	0	0	0	0	0	0	0	0	0	0	0	
"Rumah Zakat35"	"Jl. Jend Sudirman No.59 Kel. Rawa Laut, Kec. Tekate"	"0721-255813 "	0	"Bandar Lampung"	0	"Rumah Zakat"	0	0	0	0	0	0	0	0	0	0	0	
"Rumah Zakat36"	"Jl. Perumnas I No.25 Kel. Harem, Kec. Waena"	"0967-571692 "	0	"Jayapura"	0	"Rumah Zakat"	0	0	0	0	0	0	0	0	0	0	0	
"Rumah Zakat37"	"Jl. Tuanku Tambusai No.34 D Kel. Jadirejo, Kec. Sukajadi"	"0761-44447 "	"0761-7097276 "	"Pekanbaru"	0	"Rumah Zakat"	0	0	0	0	0	0	0	0	0	0	0	
"Rumah Zakat38"	"Jl. Ratulangi 119"	"0411-2332124 "	0	"Makasar"	0	"Rumah Zakat"	0	0	0	0	0	0	0	0	0	0	0	
"Rumah Zakat39"	"Jl. Diponegoro No.15 F"	"0751-7873238 "	0	"Padang"	0	"Rumah Zakat"	0	0	0	0	0	0	0	0	0	0	0	
"Rumah Zakat40"	"Jl. Basuki Rahmat No.2 Kel. Ario Kemuning, Kec. Kemuning"	"0711-7005100 "	0	"Palembang"	0	"Rumah Zakat"	0	0	0	0	0	0	0	0	0	0	0	
"Rumah Zakat41"	"Jl. Setiabudi No. 32D Medan Sunggal"	"061-8227435 "	"061-77812344 "	"Medan"	0	"Rumah Zakat"	0	0	0	0	0	0	0	0	0	0	0	
"Rumah Zakat42"	"Pelataran parkir Hotel Inna Dharma Deli Lt.1 Jl. Balai Kota No.2"	"061-4528638 "	0	"Medan"	0	"Rumah Zakat"	0	0	0	0	0	0	0	0	0	0	0	
"Rumah Zakat43"	"Gedung BIEC, JL. M. Yamin No.82 Kel. Tempaja Utara, Kec. Samarinda Utara"	"0541-7766033 "	0	"Samarind"	0	"Rumah Zakat"	0	0	0	0	0	0	0	0	0	0	0	
"PKPU"	"Jl. Raya Condet No. 27-G Batu Ampar"	"0804 100 2000"	"021-87780013"	"Jakarta Timur"	"http://www.pkpu.or.id/"	0	0	0	0	0	0	0	0	0	0	0	0	
"PKPU1"	"Jl. Raya Pasar Minggu, Kavling III No 49 (Depan Gedung Sucofindo) Pancoran"	0	0	"Jakarta Selatan"	0	"PKPU"	0	0	0	0	0	0	0	0	0	0	0	
"PKPU2"	"Jl. Setiabudi No. 70 Kelurahan Sumurboto, Kecamatan Banyumanik"	"024-7477405"	"021-70787578"	"Semarang"	0	"PKPU"	0	0	0	0	0	0	0	0	0	0	0	
"PKPU3"	"Jl. Prof DR Sardjito No.4, Kelurahan Cokrodiningratan, Kecamatan Jetis"	"0274-561525"	"0274-555041"	"Yogyakarta"	0	"PKPU"	0	0	0	0	0	0	0	0	0	0	0	
"PKPU4"	"Jl. Ngagel Madya no.83"	"031-5039285"	"031-5039285"	"Surabaya"	0	"PKPU"	0	0	0	0	0	0	0	0	0	0	0	
"PKPU5"	"Jl. Sukarno hatta No.45 Desa Geuceu Menara, Kecamatan Jaya Baru"	"0651-43460"	0	"Banda Aceh"	0	"PKPU"	0	0	0	0	0	0	0	0	0	0	0	
"PKPU6"	"Jl. Setia Budi Komp. Business Point Blok C No.51, Kelurahan Tanjung Rejo, Kecamatan Medan Sunggal, Medan. "	"061-8212502"	"061-8212643"	"Medan"	0	"PKPU"	0	0	0	0	0	0	0	0	0	0	0	
"PKPU7"	"Jl. Raya By Pass No. 16B Padang. "	"0751-7054623"	0	"Padang"	0	"PKPU"	0	0	0	0	0	0	0	0	0	0	0	
"PKPU8"	"Jl. Prof. Dr. Hamka No. 24 Gurun Panjang Bukittinggi. "	"0752-9916263"	0	"Bukittinggi"	0	"PKPU"	0	0	0	0	0	0	0	0	0	0	0	
"PKPU9"	"Jl. Merapi No. 92, Kelurahan Panorama, Kecamatan Gading Cempaka"	"0736-26425"	"0736-26425"	"Bengkulu"	0	"PKPU"	0	0	0	0	0	0	0	0	0	0	0	
"PKPU10"	"Jl. Aroeppala No. 48 Makasar. "	"0411-886057"	0	"Makassar"	0	"PKPU"	0	0	0	0	0	0	0	0	0	0	0	
"PKPU11"	"Jl. Jendral Gatot Subroto No. 46B"	"022-7310407"	0	"Bandung"	0	"PKPU"	0	0	0	0	0	0	0	0	0	0	0	
"PKPU12"	"Jl. Cikutra No. 138, Kelurahan Padasuka, Kecamatan Cibeunying Kidul"	"022-7100035"	0	"Bandung"	0	"PKPU"	0	0	0	0	0	0	0	0	0	0	0	
"PKPU13"	"Griya Wikarsa Baru 18"	"0321-330875"	0	" Mojokerto"	0	"PKPU"	0	0	0	0	0	0	0	0	0	0	0	
"PKPU14"	"Jl. Dr Soetomo Gg Kecamatan No. 8"	"0321-870255"	0	" Jombang"	0	"PKPU"	0	0	0	0	0	0	0	0	0	0	0	
"PKPU15"	"Jl. Raya Galuh Mas Blok XII No. A-6"	"0267-8456484"	0	" Karawang"	0	"PKPU"	0	0	0	0	0	0	0	0	0	0	0	
"PKPU16"	"Jl. Sutaatmaja Blok Sukahayu RT 69 RW 09"	"0260-9141062"	0	" Subang"	0	"PKPU"	0	0	0	0	0	0	0	0	0	0	0	
"PKPU17"	"Jl. Ciremai Raya Ruko Blok A No. 4 Harja Mukti"	"0231-480965"	0	" Cirebon"	0	"PKPU"	0	0	0	0	0	0	0	0	0	0	0	
"PKPU18"	"Jl. Ruhui Rahayu No. 156, Simpang 4 Lampu Merah Balikpapan Baru"	"0542-878672"	0	"Balikpapan"	0	"PKPU"	0	0	0	0	0	0	0	0	0	0	0	
"PKPU19"	"Jl. Soekarno Hatta No. 182B Simpang Pancuran Koto Nan IV"	0	0	" Payakumbuh"	0	"PKPU"	0	0	0	0	0	0	0	0	0	0	0	
"PKPU20"	"Jl. Letjenpol Soemarto Gg. Tampomas RT 03/RW 1 No. 149 Purwokerto. "	"0281-7958080"	0	" Purwokerto"	0	"PKPU"	0	0	0	0	0	0	0	0	0	0	0	
"PKPU21"	"Jl. Jepara No. 421"	"0291-3304337"	0	"Kudus"	0	"PKPU"	0	0	0	0	0	0	0	0	0	0	0	
"PKPU22"	"Jl. Werkudoro No. 173"	"(0283) 35 81 30"	0	" Tegal"	0	"PKPU"	0	0	0	0	0	0	0	0	0	0	0	
"PKPU23"	"Jl. Perintis Kemerdekaan RT 05/RW 15 Siswodipuran"	"0276-3336383"	0	" Boyolali"	0	"PKPU"	0	0	0	0	0	0	0	0	0	0	0	
"PKPU24"	"Jl. Muwardi No. 21 Badranasri RT 02 / RW 12 Cangakan"	"0271-6497011"	0	" Karanganyar"	0	"PKPU"	0	0	0	0	0	0	0	0	0	0	0	
"PKPU25"	"Jl. Sultan Agung 16, Lumajang. "	"0334-879044"	0	" Lumajang"	0	"PKPU"	0	0	0	0	0	0	0	0	0	0	0	
"PKPU26"	"Jl. Soekarno Hatta No 31A, Sambong Kanigoro"	"0342-7846868"	0	" Blitar"	0	"PKPU"	0	0	0	0	0	0	0	0	0	0	0	
"PKPU27"	"Pesona Sekar Gading AA-25, Sekardangan"	"031-8063272"	0	" Sidoarjo"	0	"PKPU"	0	0	0	0	0	0	0	0	0	0	0	
"PKPU28"	"Jl. Rambutan No.23 Kelurahan Wowanggu, Kecamatan Wua-wua"	"0401-3191950"	"0401-3191950"	"Kendari"	0	"PKPU"	0	0	0	0	0	0	0	0	0	0	0	
"PKPU29"	"Jl. Ir. H. Juanda I No. 1A, Kelurahan Lolu Utara, Kecamatan Palu Selatan, Kota Palu 94112"	"0451-455473"	"0451-455473"	"Palu"	0	"PKPU"	0	0	0	0	0	0	0	0	0	0	0	
"PKPU30"	"Jl Pogidon Raya No 110, Gedung RSI Sitti Maryam Lt III, Kelurahan Tuminting, Kecamatan Tuminting"	"0431-3631345"	0	"Manado"	0	"PKPU"	0	0	0	0	0	0	0	0	0	0	0	
"PKPU31"	"Jl. MT. Haryono No 156, Simpang Lampu Merah Balikpapan Baru. "	"0542-7039222"	0	"Balikpapan"	0	"PKPU"	0	0	0	0	0	0	0	0	0	0	0	
"PKPU32"	"Klinik Al-Aqsho. Komp. BTN Bukit Manusela Blok B/5-6, Jl. Kebun Cengkeh, Kecamatan Air Kuning, Ambon 97128"	"0911-312658"	"0911-312658"	"Ambon"	0	"PKPU"	0	0	0	0	0	0	0	0	0	0	0	
"PKPU33"	"Jl. Cempaka No. 79 Rt. 09/Rw. 02 Tanah Tinggi Ternate"	0	0	"Ternate"	0	"PKPU"	0	0	0	0	0	0	0	0	0	0	0	
"Ulil Albab"	"Jl. Gagak Hitam 117A"	"061-8448478"	0	"Medan"	"http://www.ulilalbab.org"	0	"Pembinaan & Pemberian Modal Usaha"	"Pembinaan & Pemberian Beasiswa"	"Pembinaan & Pelayanan Kesehatan, dll"	0	0	0	0	0	0	0	0	
"Yayasan Fajar Islam"	"Jalan Mutiara No.32 Sumur Batu, Kemayoran"	"021-4263882"	0	"Jakarta Pusat"	"http://www.fajarislam.org"	0	"Beasiswa, Santunan untuk jompo, bantuan medis"	"Koperasi Syariah, TKA/TPA/TKIT"	0	0	0	0	0	0	0	0	0	
"Ar-Rahman"	"Komplek Bumi Malaka Asri III, Jl. Matahari Raya  No. 2, Duren Sawit"	"021-86602955"	0	"Jakarta Timur"	"http://e-arrahman.com"	0	"Gerakan Nasional Tadabbur Qur’an"	"Gerakan Wakaf Al-Qur’an Terjemah"	"Santunan Guru Ngaji"	"Beasiswa Santri Pengemban Amanah Al-Qur’an"	0	0	0	0	0	0	0	
"PPPA"	"Kawasan Bisnis CBD Ciledug, Blok A3, No.21 Jl. HOS. Cokroaminoto, Karang Tengah, Cilledug"	"021-73453000"	"021-73444875"	"Tangerang"	"http://www.pppa.or.id"	0	0	0	0	0	0	0	0	0	0	0	0	
"PPPA1"	"Ruko Bangbarung Grande Blok K-6 Jl. Pandu Raya No. 27 Bantarjati"	"0251-8322 355"	"0251-835 4515"	"Bogor."	0	"PPPA"	0	0	0	0	0	0	0	0	0	0	0	
"PPPA2"	"Jl. Gajah Raya No. 111B"	"024-3304 4345"	0	"Semarang"	0	"PPPA"	0	0	0	0	0	0	0	0	0	0	0	
"PPPA3"	"Jl. Bend. Sigura-gura Barat Raya 16E Sumber Sari Kec. Lowokwaru"	"0341-553 644"	"0341-553 645 "	"Malang."	0	"PPPA"	0	0	0	0	0	0	0	0	0	0	0	
"PPPA4"	"Jl. Kasuari No. 1 Demangan, Catur Tunggal Depok"	"0274-544 020"	0	"Sleman"	0	"PPPA"	0	0	0	0	0	0	0	0	0	0	0	
"Badan Amil Zakat Provinsi DIY"	"Jl. Kapas No. 3 Semaki, Yogyakarta"	0	0	"Yogyakarta"	0	0	0	0	0	0	0	0	0	0	0	0	0	
"Badan Amul Zakat Kota Yogyakarta"	"Komplek BalaiKota Yogyakarta"	0	0	"Yogyakarta"	0	0	0	0	0	0	0	0	0	0	0	0	0	
"Badan Amil Zakat Kab. Bantul"	"Jl. DR. Wahidin Sudirohusodo No. 16 Bantul"	0	0	"Bantul"	0	0	0	0	0	0	0	0	0	0	0	0	0	
"Badan Amil Zakat Kab. Kulonprogo"	"Komplek Kantor Kabupaten Kulonprogo"	0	0	"Kulonprogo"	0	0	0	0	0	0	0	0	0	0	0	0	0	
"Badan Amil Zakat Kab. Gunungkidul"	"Komplek Kantor Kabupaten Gunungkidul"	0	0	"Gunung Kidul"	0	0	0	0	0	0	0	0	0	0	0	0	0	
"Badan Amil Zakat Kab. Sleman"	"Komplek Kantor Kabupaten Sleman"	0	0	"Sleman"	0	0	0	0	0	0	0	0	0	0	0	0	0	
"Baitul Maal Hidayatullah"	"Balong, Donoharjo, Ngaglik, Sleman"	0	0	"Sleman"	0	0	0	0	0	0	0	0	0	0	0	0	0	
"LAZIS UII"	"Jl. Cik Di Tiro No. 1"	0	0	"Sleman"	0	0	0	0	0	0	0	0	0	0	0	0	0	
"LAZIS Muhammadiyah"	"Jl. KH. Ahmad Dahlan"	0	0	"Sleman"	0	0	0	0	0	0	0	0	0	0	0	0	0	
"LAZIS PERKASA"	"Jl. Kusumanegara"	0	0	"Sleman"	0	0	0	0	0	0	0	0	0	0	0	0	0	
"LAZIS Rumah Zakat TAJ QURO"	"Sihono, Panggang"	0	0	"Gunung Kidul"	0	0	0	0	0	0	0	0	0	0	0	0	0	
"LAZIS TAZKIYA"	"Gunungkidul"	0	0	"Sleman"	0	0	0	0	0	0	0	0	0	0	0	0	0	
"Lumbung Zakat Indonesia"	"Tempel, Sleman"	0	0	"Sleman"	0	0	0	0	0	0	0	0	0	0	0	0	0	
"LAZIS SYUHADA"	"Komplek Masjid Syuhada"	0	0	"Sleman"	0	0	0	0	0	0	0	0	0	0	0	0	0	
"LAZIS AMRATANI"	"Jl. Palagan Tentara Pelajar"	0	0	"Sleman"	0	0	0	0	0	0	0	0	0	0	0	0	0	
"LAZIS Bina Umat"	"Jl. Timoho"	0	0	"Sleman"	0	0	0	0	0	0	0	0	0	0	0	0	0	
"LAZIS Dompet Shalahudin"	"Masjid Komplek UGM"	0	0	"Sleman"	0	0	0	0	0	0	0	0	0	0	0	0	0	
"LAZIS AL'FALAH"	"Jl. Monjali, Sinduadi, Malti"	0	0	"Sleman"	0	0	0	0	0	0	0	0	0	0	0	0	0	
"LAZIS Portal Infaq"	"Jl. Bantul, Bantul"	0	0	"Sleman"	0	0	0	0	0	0	0	0	0	0	0	0	0	
"LAZIS Dompet Dhuafa Republika"	"Jl. Veteran Yogyakarta"	0	0	"Sleman"	0	0	0	0	0	0	0	0	0	0	0	0	0	
"LAZ DPU - DT"	"Jl. Ny. Ahmad Dahlan"	0	0	"Sleman"	0	0	0	0	0	0	0	0	0	0	0	0	0	
"Baitul Maal Al'Khautsar"	"Jl. Tentara Pelajar Palagan"	0	0	"Sleman"	0	0	0	0	0	0	0	0	0	0	0	0	0	
"LAZIS Dewan Dakwah Islamiyah"	"Jl. Timoho"	0	0	"Sleman"	0	0	0	0	0	0	0	0	0	0	0	0	0	
"Rumah Zakat Muhammadiyah"	"Jl. Gedongkuning"	0	0	"Sleman"	0	0	0	0	0	0	0	0	0	0	0	0	0	
"LAZIS NU 2"	"Jl. Bantul"	0	0	"Sleman"	0	"LAZIS NU"	0	0	0	0	0	0	0	0	0	0	0	
"UPZ ESQ "	"Komplek LPP Jl. Solo"	0	0	"Sleman"	0	0	0	0	0	0	0	0	0	0	0	0	0	
"Badan Amil Zakat Nasional"	"Jl. Kebon Sirih Raya No.57"	213904555	213913777	"Jakarta Pusat"	"http://www.baznas.or.id"	0												
"Al-Azhar Peduli Umat"	"Komplek Masjid Agung Al-Azhar Jl. Sisingamangaraja, Kebayoran Baru"	"021-722 1504"	"021-726 5241"	"Jakarta Selatan"	"http://www.alazharpeduli.com"	0												
"Swadaya Ummah"	"Gedung Bank Zakat Jl. HR Soebrantas No. 21"	"0761-589100"	"0761-589200"	"Panam"	"http://www.swadayaummah.or.id"	0												
"Baitul Maal Hidayatullah"	"Jl. H. Samali No. 79B Pejaten Barat Pasar Minggu"	"021-797 5770"	"021-797 5614"	"Jakarta Selatan"	"http://www.bmh.or.id"	0												
"Infak Peduli Masyarakat Islami"	"Jl. Raya Cimanglid, No. 61 Ds. Sukamantri Kecamatan Tamansari"	"0251 8388 006"	"0251 8389 788"	"Bogor"	"http://www.zakatinfak.com"	0												
"Yayasan Dana Sosial Al-Falah"	"Jl. Kertajaya 8C/17 "	"031-505 6650"	"031-505 6656"	"Surabaya"	"http://www.ydsf.org/"	0												
"YDSF Gresik"	"Jl. Panglima Sudirman 8"	"031-398 0435"	0	"Gresik"	"http://ydsfgresik.com/"	"Yayasan Dana Sosial Al-Falah"												
"YDSF Sidoarjo"	"Graha Anggrek Mas Regency A-2 "	"031-807 0602"		"Sidoarjo"		"Yayasan Dana Sosial Al-Falah"												
"YDSF Malang"	"Jl. Kahuripan 12 Kota"	"0341 - 7054156"		"Malang"	"http://www.ydsf-malang.or.id/"	"Yayasan Dana Sosial Al-Falah"												
"YDSF Jakarta"	"Jl. Terusan HR Rasuna Said No. 25, Mampang Prapatan "	"(021) 526 6962"	"(021) 526 6963"	"Jakarta Selatan"	"http://ydsfjakarta.org/"	"Yayasan Dana Sosial Al-Falah"												
"Amanah Tafakul"	"Jl. Mampang Prapatan Raya No. 100"	"(021) 7991234"	"(021) 79193662"	"Jakarta Selatan"	0	0												
"Baitul Maal Muamalat"	"Ged. Dana Pensiun Telkom Lt. II Jl. Letjend S. Parman Kav. 56"	"(021) 5326744"	"(021) 5326731"	"Jakarta Barat"	"http://www.baitulmaal.net"	0												
"Baituzakkah Pertamina"	"Jl. Medan Merdeka Timur No. 11"	"(021) 38503166"	"(021) 3862515"	"Jakarta Pusat"														
"Bamuis Bank BNI"	" Jl. Pejompongan Raya 23"	"021) 5743573"	"(021) 5743964"	"Jakarta Pusat"	"http://www.bamuisbni.com"													
"Badan Amil Zakat DKI Jakarta"	"Gedung Prasada Sasana Karya Jl. Suryo Pranoto No.08"	"(021) 3901367"	"021-63866761"	"Jakarta Pusat"	"http://www.bazisdki.go.id"													
"Baitul Maal Pupuk Kujang"	"Jl. Jend. Ahmad Yani No. 39"	"0264-316141"	"0264-314235"	"Cikampek"														
"Baitul Maal Pupuk Kaltim"	"Lantai Dasar Masjid Baiturrahman Jl. Tulip 01 PC VI PT Pupuk Kaltim Timur"	"0548-41202"	"0548-20185"	"Bontang"														
"Badan Pengelola Zakat Infak Sedekah Bank Mandiri"	"Plasa MANDIRI Gatot Subroto Kav. 36-38"	"021-5265045"	"021-52964066"	"Jakarta Pusat"	"http://www.bpzismandiri.org"													
"Bina Sejahtera Mitra Ummat"	"Gedung Bank Syariah Mandiri Lt. Dasar Jl. M. H. Tamrin No. 5"	"(021) 2300509"	"(021) 39832976"	"Jakarta Pusat"														
"Dompet Peduli Ummat Daarut Tauhid"	" Jl. Geger Kalong Girang No. 32"	"022-70775632"	"022-2021862"	"Bandung"	"httP://www.dpu-online.com"													
"Dompet Peduli Ummat Daarut Tauhid 2"	"Jl. Ir. H. R. Juanda No. 50 Ciputat"	"(021) 7401460"	"(021) 7401351"	"Jakarta Selatan"	"http://www.dtjakarta.or.id/"	"Dompet Peduli Ummat Daarut Tauhid"												
"Dompet Peduli Ummat Daarut Tauhid 3"	"Jl. Sutisna Senjaya Belakang No.129"	"(0265) 338535"	"0265-7042525"	"Tasikmalaya"	"http://www.priangantimur.dpu-online.com/"	"Dompet Peduli Ummat Daarut Tauhid"												
"Dompet Peduli Ummat Daarut Tauhid 4"	"Jl. Jabaru IV No.7, Rt.04/05, Kelurahan Pasir Kuda Kecamatan Ciomas"	"(0251) 8631126 "	"(0251) 8631126 "	"Bogor"		"Dompet Peduli Ummat Daarut Tauhid"												
"Dompet Peduli Ummat Daarut Tauhid 5"	"Jl. KH. Agus Salim No. 56 A Notoprajan, Ngampilan"	"(0274) 6560086"	"(0274) 566171"	"Yogyakarta"	"http://www.dpudt-jogja.org"	"Dompet Peduli Ummat Daarut Tauhid"												
"Dompet Peduli Ummat Daarut Tauhid 6"	"Jl. Dr. Wachidin No. Family House G-8 Kecamatan Candi Sari"	"(024) 844993"	"-"	"Semarang"	"http://www.dpudt-semarang.com/"	"Dompet Peduli Ummat Daarut Tauhid"												
"Dompet Peduli Ummat Daarut Tauhid 7"	"Jl. Diponegoro No.170"	"(0721) 488309"	"(0721) 486964"	"Bandar Lampung"		"Dompet Peduli Ummat Daarut Tauhid"												
"Dompet Peduli Ummat Daarut Tauhid 8"	"Jl. Seduduk Putih No. 005 Rt. 17/7"	"(0711) 739 0009"	"(0711) 812763"	"Palembang"		"Dompet Peduli Ummat Daarut Tauhid"												
"Lembaga Amil Zakat Dewan Dakwah Indonesia"	"Jl. Kramat Raya 45"	"(021) 31901233 "	"(021) 3903291"	"Jakarta Pusat"	"http://www.lazisdewandakwah.org"													
"Lembaga Amil Zakat Persaudaraan Haji Indonesia"	"Jl. Tegalan No. 1 Matram"	"021-8576645"	"021-8576645"	"Jakarta Timur"														
"Lembaga Amil Zakat dan Infaq Malang"	"Jl. Bogowonto No. 45"	"031-5621212"	"031-5681829"	"Surabaya"														
"Lembaga Amil Zakat Al Hijrah"	"Jl. Pasundan 18 Kec. Medan Petisah"	"061-8224668"	"061-77842767"	"Medan"														
"Pusat Zakat Ummat"	" Jl. Perintis Kemerdekaan No. 2"	"(022) 4220704"	"022-4220702"	"Bandung"														
"Lembaga Amil Zakat Yaumil PT Badak LNG"	"Masjid Al Kautsar Komp. PT. Badak LNG"	"0548-5108555"	"0548-552189"	"Bontang"														
"LAZIS Garuda"	"SBU Garuda Sentra Medika, Jl. Angkasa Blok B 15 No. 1 Kemayoran"	"021-4243413"	"021-4243227"	"Jakarta Pusat"	"http://www.Lazisgarudaindonesia.or.id"													
"LAZIS NU"	"Jl. Kramat Raya No. 164"	"021-3102913"	"021-3102913"	"Jakarta Pusat"														
"Lembaga Manajemen Infaq"	"Komplek Ruko Taman Intan Nginden Jl. Nginden Intan Raya N0 12 "	"031-5621212"	"031-5920299"	"Surabaya"	"http://www.lmi-amilzakat.com"													
"Portal Infaq"	"Jl. Radio IV No. 8 A Kebayoran Baru"	"(021) 72786073"	"(021) 72786074"	"Jakarta Selatan"														
"Yayasan Baitul Maal BRI"	"Gedung Olah Raga BRI Lt. 2 Jl. Jend Sudirman Kav. 44-46"	"(021) 57932809"	"(021) 5752724/26"	"Jakarta Barat"	"http://www.ybm-bri.or.id"													
"Dompet Sosial Ummul Quro"	" Jl. Dederuk 30"	"022-2500116"	"022-2500116"	"Bandung"														
